{
  "id": "case-001",
  "stageNumber": 1,
  "difficulty": "easy",
  "title": "닫힌 서재와 열린 창문",
  "publicDescription": "폭풍우가 저택을 뒤흔든 밤, 서재 문은 안쪽에서 잠겨 있었고 창문은 활짝 열려 있었다. 책상 옆에는 와인잔 하나가 조용히 식어 가고 있었다.",
  "question": "서재의 닫힌 문과 열린 창문 사이에서, 피해자는 누구에게 어떻게 죽임을 당했는가?",
  "truth": "범인은 피해자의 조카다. 조카는 유언장 변경으로 상속권을 잃을까 두려워 피해자의 와인잔에 독을 넣었다. 이후 창문을 일부러 열어 외부 침입처럼 보이게 꾸몄다.",
  "requiredKeywords": ["조카", "와인잔", "독", "유언장", "창문"],
  "bonusKeywords": ["상속", "외부 침입"],
  "acceptedAnswerSummary": "범인은 조카이며, 유언장 변경과 상속 문제를 막기 위해 와인잔에 독을 넣은 뒤 창문을 열어 외부 침입처럼 위장했다.",
  "hints": [
    {
      "hintId": "case-001-hint-1",
      "order": 1,
      "triggerType": "time_elapsed",
      "strength": "weak",
      "publicText": "이 죽음은 우연이 아니다. 누군가 의도한 자국이 남아 있다.",
      "internalNote": "원인은 계획된 독살로 좁힌다."
    },
    {
      "hintId": "case-001-hint-2",
      "order": 2,
      "triggerType": "first_player_solved",
      "strength": "medium",
      "publicText": "현장은 침입 사건처럼 보이도록 일부러 흐트러져 있다.",
      "internalNote": "창문을 연 행위가 핵심 위장이다."
    },
    {
      "hintId": "case-001-hint-3",
      "order": 3,
      "triggerType": "stage_pressure",
      "strength": "strong",
      "publicText": "가장 먼저 흔들린 사람은 유산을 잃을 가능성이 있는 가까운 친족이다.",
      "internalNote": "조카와 유언장, 상속권을 연결한다."
    }
  ],
  "reviewNotes": "MVP 1번 사건. 독살, 위장, 친족 동기를 가장 직관적으로 읽히게 만든다.",
  "status": "approved",
  "version": "1.0.0"
}
